{
  "battinfo_version": "0.1.0",
  "profile": "curated",
  "record": {
    "id": "cellinfo:Panasonic_NCR2170‑M",
    "title": "NCR2170‑M",
    "source": "https://github.com/TUMFTM/TruckBatteryDesign/raw/main/Step1_cell_selection/inputs/CellDatabase_v6.xlsx"
  },
  "battery": {
    "id": "Panasonic_NCR2170‑M",
    "type": "cell",
    "chemistry": "Li-ion",
    "manufacturer": {
      "name": "Panasonic"
    },
    "nominal_capacity": {
      "value": 5.02,
      "unit": "Ah"
    },
    "nominal_voltage": {
      "value": 3.6,
      "unit": "V"
    },
    "mass": {
      "value": 0.07,
      "unit": "kg"
    }
  },
  "measurements": [
    {
      "name": "CycleLife",
      "property": "CycleLife",
      "quantity": {
        "value": "NaN",
        "unit": "count"
      },
      "method": "https://github.com/TUMFTM/TruckBatteryDesign/raw/main/Step1_cell_selection/inputs/CellDatabase_v6.xlsx"
    },
    {
      "name": "UpperVoltageLimit",
      "property": "UpperVoltageLimit",
      "quantity": {
        "value": 4.2,
        "unit": "V"
      },
      "method": "https://github.com/TUMFTM/TruckBatteryDesign/raw/main/Step1_cell_selection/inputs/CellDatabase_v6.xlsx"
    },
    {
      "name": "LowerVoltageLimit",
      "property": "LowerVoltageLimit",
      "quantity": {
        "value": 2.5,
        "unit": "V"
      },
      "method": "https://github.com/TUMFTM/TruckBatteryDesign/raw/main/Step1_cell_selection/inputs/CellDatabase_v6.xlsx"
    },
    {
      "name": "DischargingCurrent",
      "property": "DischargingCurrent",
      "quantity": {
        "value": 2.51,
        "unit": "A"
      },
      "method": "https://github.com/TUMFTM/TruckBatteryDesign/raw/main/Step1_cell_selection/inputs/CellDatabase_v6.xlsx"
    },
    {
      "name": "MaximumContinuousDischargingCurrent",
      "property": "MaximumContinuousDischargingCurrent",
      "quantity": {
        "value": 15.8,
        "unit": "A"
      },
      "method": "https://github.com/TUMFTM/TruckBatteryDesign/raw/main/Step1_cell_selection/inputs/CellDatabase_v6.xlsx"
    },
    {
      "name": "ChargingCurrent",
      "property": "ChargingCurrent",
      "quantity": {
        "value": 2.51,
        "unit": "A"
      },
      "method": "https://github.com/TUMFTM/TruckBatteryDesign/raw/main/Step1_cell_selection/inputs/CellDatabase_v6.xlsx"
    },
    {
      "name": "MaximumContinuousChargingCurrent",
      "property": "MaximumContinuousChargingCurrent",
      "quantity": {
        "value": 5.02,
        "unit": "A"
      },
      "method": "https://github.com/TUMFTM/TruckBatteryDesign/raw/main/Step1_cell_selection/inputs/CellDatabase_v6.xlsx"
    },
    {
      "name": "Height",
      "property": "Height",
      "quantity": {
        "value": 0.07,
        "unit": "m"
      },
      "method": "https://github.com/TUMFTM/TruckBatteryDesign/raw/main/Step1_cell_selection/inputs/CellDatabase_v6.xlsx"
    },
    {
      "name": "Diameter",
      "property": "Diameter",
      "quantity": {
        "value": 0.021,
        "unit": "m"
      },
      "method": "https://github.com/TUMFTM/TruckBatteryDesign/raw/main/Step1_cell_selection/inputs/CellDatabase_v6.xlsx"
    }
  ]
}