{
  "battinfo_version": "0.1.0",
  "profile": "curated",
  "record": {
    "id": "cellinfo:Kokam_SPLB160460330H",
    "title": "SPLB160460330H",
    "source": "https://github.com/TUMFTM/TruckBatteryDesign/raw/main/Step1_cell_selection/inputs/CellDatabase_v6.xlsx"
  },
  "battery": {
    "id": "Kokam_SPLB160460330H",
    "type": "cell",
    "chemistry": "NMC",
    "manufacturer": {
      "name": "Kokam"
    },
    "nominal_capacity": {
      "value": 200.0,
      "unit": "Ah"
    },
    "nominal_voltage": {
      "value": 3.7,
      "unit": "V"
    },
    "mass": {
      "value": 5.26,
      "unit": "kg"
    }
  },
  "measurements": [
    {
      "name": "CycleLife",
      "property": "CycleLife",
      "quantity": {
        "value": 800.0,
        "unit": "count"
      },
      "method": "https://github.com/TUMFTM/TruckBatteryDesign/raw/main/Step1_cell_selection/inputs/CellDatabase_v6.xlsx"
    },
    {
      "name": "UpperVoltageLimit",
      "property": "UpperVoltageLimit",
      "quantity": {
        "value": 4.2,
        "unit": "V"
      },
      "method": "https://github.com/TUMFTM/TruckBatteryDesign/raw/main/Step1_cell_selection/inputs/CellDatabase_v6.xlsx"
    },
    {
      "name": "LowerVoltageLimit",
      "property": "LowerVoltageLimit",
      "quantity": {
        "value": 2.7,
        "unit": "V"
      },
      "method": "https://github.com/TUMFTM/TruckBatteryDesign/raw/main/Step1_cell_selection/inputs/CellDatabase_v6.xlsx"
    },
    {
      "name": "DischargingCurrent",
      "property": "DischargingCurrent",
      "quantity": {
        "value": 100.0,
        "unit": "A"
      },
      "method": "https://github.com/TUMFTM/TruckBatteryDesign/raw/main/Step1_cell_selection/inputs/CellDatabase_v6.xlsx"
    },
    {
      "name": "MaximumContinuousDischargingCurrent",
      "property": "MaximumContinuousDischargingCurrent",
      "quantity": {
        "value": 400.0,
        "unit": "A"
      },
      "method": "https://github.com/TUMFTM/TruckBatteryDesign/raw/main/Step1_cell_selection/inputs/CellDatabase_v6.xlsx"
    },
    {
      "name": "ChargingCurrent",
      "property": "ChargingCurrent",
      "quantity": {
        "value": 40.0,
        "unit": "A"
      },
      "method": "https://github.com/TUMFTM/TruckBatteryDesign/raw/main/Step1_cell_selection/inputs/CellDatabase_v6.xlsx"
    },
    {
      "name": "MaximumContinuousChargingCurrent",
      "property": "MaximumContinuousChargingCurrent",
      "quantity": {
        "value": 200.0,
        "unit": "A"
      },
      "method": "https://github.com/TUMFTM/TruckBatteryDesign/raw/main/Step1_cell_selection/inputs/CellDatabase_v6.xlsx"
    },
    {
      "name": "Height",
      "property": "Height",
      "quantity": {
        "value": 0.017,
        "unit": "m"
      },
      "method": "https://github.com/TUMFTM/TruckBatteryDesign/raw/main/Step1_cell_selection/inputs/CellDatabase_v6.xlsx"
    },
    {
      "name": "Width",
      "property": "Width",
      "quantity": {
        "value": 0.325,
        "unit": "m"
      },
      "method": "https://github.com/TUMFTM/TruckBatteryDesign/raw/main/Step1_cell_selection/inputs/CellDatabase_v6.xlsx"
    },
    {
      "name": "Length",
      "property": "Length",
      "quantity": {
        "value": 0.455,
        "unit": "m"
      },
      "method": "https://github.com/TUMFTM/TruckBatteryDesign/raw/main/Step1_cell_selection/inputs/CellDatabase_v6.xlsx"
    }
  ]
}