{
  "battinfo_version": "0.1.0",
  "profile": "curated",
  "record": {
    "id": "cellinfo:Lishen_LR2170SC",
    "title": "LR2170SC",
    "source": "https://github.com/TUMFTM/TruckBatteryDesign/raw/main/Step1_cell_selection/inputs/CellDatabase_v6.xlsx"
  },
  "battery": {
    "id": "Lishen_LR2170SC",
    "type": "cell",
    "chemistry": "NCA",
    "manufacturer": {
      "name": "Lishen"
    },
    "nominal_capacity": {
      "value": 5.0,
      "unit": "Ah"
    },
    "nominal_voltage": {
      "value": 3.6,
      "unit": "V"
    },
    "mass": {
      "value": 0.07,
      "unit": "kg"
    }
  },
  "measurements": [
    {
      "name": "CycleLife",
      "property": "CycleLife",
      "quantity": {
        "value": 1000.0,
        "unit": "count"
      },
      "method": "https://github.com/TUMFTM/TruckBatteryDesign/raw/main/Step1_cell_selection/inputs/CellDatabase_v6.xlsx"
    },
    {
      "name": "UpperVoltageLimit",
      "property": "UpperVoltageLimit",
      "quantity": {
        "value": 4.2,
        "unit": "V"
      },
      "method": "https://github.com/TUMFTM/TruckBatteryDesign/raw/main/Step1_cell_selection/inputs/CellDatabase_v6.xlsx"
    },
    {
      "name": "LowerVoltageLimit",
      "property": "LowerVoltageLimit",
      "quantity": {
        "value": 2.75,
        "unit": "V"
      },
      "method": "https://github.com/TUMFTM/TruckBatteryDesign/raw/main/Step1_cell_selection/inputs/CellDatabase_v6.xlsx"
    },
    {
      "name": "DischargingCurrent",
      "property": "DischargingCurrent",
      "quantity": {
        "value": 1.0,
        "unit": "A"
      },
      "method": "https://github.com/TUMFTM/TruckBatteryDesign/raw/main/Step1_cell_selection/inputs/CellDatabase_v6.xlsx"
    },
    {
      "name": "MaximumContinuousDischargingCurrent",
      "property": "MaximumContinuousDischargingCurrent",
      "quantity": {
        "value": 10.0,
        "unit": "A"
      },
      "method": "https://github.com/TUMFTM/TruckBatteryDesign/raw/main/Step1_cell_selection/inputs/CellDatabase_v6.xlsx"
    },
    {
      "name": "ChargingCurrent",
      "property": "ChargingCurrent",
      "quantity": {
        "value": 1.0,
        "unit": "A"
      },
      "method": "https://github.com/TUMFTM/TruckBatteryDesign/raw/main/Step1_cell_selection/inputs/CellDatabase_v6.xlsx"
    },
    {
      "name": "MaximumContinuousChargingCurrent",
      "property": "MaximumContinuousChargingCurrent",
      "quantity": {
        "value": 1.5,
        "unit": "A"
      },
      "method": "https://github.com/TUMFTM/TruckBatteryDesign/raw/main/Step1_cell_selection/inputs/CellDatabase_v6.xlsx"
    },
    {
      "name": "Height",
      "property": "Height",
      "quantity": {
        "value": 0.0709,
        "unit": "m"
      },
      "method": "https://github.com/TUMFTM/TruckBatteryDesign/raw/main/Step1_cell_selection/inputs/CellDatabase_v6.xlsx"
    },
    {
      "name": "Diameter",
      "property": "Diameter",
      "quantity": {
        "value": 0.0217,
        "unit": "m"
      },
      "method": "https://github.com/TUMFTM/TruckBatteryDesign/raw/main/Step1_cell_selection/inputs/CellDatabase_v6.xlsx"
    }
  ]
}