{
  "battinfo_version": "0.1.0",
  "profile": "curated",
  "record": {
    "id": "cellinfo:Eagle_Picher_Technologies_LLC_LP_34100",
    "title": "LP 34100",
    "source": "https://github.com/TUMFTM/TruckBatteryDesign/raw/main/Step1_cell_selection/inputs/CellDatabase_v6.xlsx"
  },
  "battery": {
    "id": "Eagle_Picher_Technologies_LLC_LP_34100",
    "type": "cell",
    "chemistry": "NCA",
    "manufacturer": {
      "name": "Eagle Picher Technologies LLC"
    },
    "nominal_capacity": {
      "value": 5.0,
      "unit": "Ah"
    },
    "nominal_voltage": {
      "value": 3.6,
      "unit": "V"
    },
    "mass": {
      "value": 0.275,
      "unit": "kg"
    }
  },
  "measurements": [
    {
      "name": "CycleLife",
      "property": "CycleLife",
      "quantity": {
        "value": "NaN",
        "unit": "count"
      },
      "method": "https://github.com/TUMFTM/TruckBatteryDesign/raw/main/Step1_cell_selection/inputs/CellDatabase_v6.xlsx"
    },
    {
      "name": "UpperVoltageLimit",
      "property": "UpperVoltageLimit",
      "quantity": {
        "value": 4.1,
        "unit": "V"
      },
      "method": "https://github.com/TUMFTM/TruckBatteryDesign/raw/main/Step1_cell_selection/inputs/CellDatabase_v6.xlsx"
    },
    {
      "name": "LowerVoltageLimit",
      "property": "LowerVoltageLimit",
      "quantity": {
        "value": 3.0,
        "unit": "V"
      },
      "method": "https://github.com/TUMFTM/TruckBatteryDesign/raw/main/Step1_cell_selection/inputs/CellDatabase_v6.xlsx"
    },
    {
      "name": "DischargingCurrent",
      "property": "DischargingCurrent",
      "quantity": {
        "value": "NaN",
        "unit": "A"
      },
      "method": "https://github.com/TUMFTM/TruckBatteryDesign/raw/main/Step1_cell_selection/inputs/CellDatabase_v6.xlsx"
    },
    {
      "name": "MaximumContinuousDischargingCurrent",
      "property": "MaximumContinuousDischargingCurrent",
      "quantity": {
        "value": 500.0,
        "unit": "A"
      },
      "method": "https://github.com/TUMFTM/TruckBatteryDesign/raw/main/Step1_cell_selection/inputs/CellDatabase_v6.xlsx"
    },
    {
      "name": "ChargingCurrent",
      "property": "ChargingCurrent",
      "quantity": {
        "value": 2.5,
        "unit": "A"
      },
      "method": "https://github.com/TUMFTM/TruckBatteryDesign/raw/main/Step1_cell_selection/inputs/CellDatabase_v6.xlsx"
    },
    {
      "name": "MaximumContinuousChargingCurrent",
      "property": "MaximumContinuousChargingCurrent",
      "quantity": {
        "value": "NaN",
        "unit": "A"
      },
      "method": "https://github.com/TUMFTM/TruckBatteryDesign/raw/main/Step1_cell_selection/inputs/CellDatabase_v6.xlsx"
    },
    {
      "name": "Height",
      "property": "Height",
      "quantity": {
        "value": 0.0074,
        "unit": "m"
      },
      "method": "https://github.com/TUMFTM/TruckBatteryDesign/raw/main/Step1_cell_selection/inputs/CellDatabase_v6.xlsx"
    },
    {
      "name": "Width",
      "property": "Width",
      "quantity": {
        "value": 0.10590000000000001,
        "unit": "m"
      },
      "method": "https://github.com/TUMFTM/TruckBatteryDesign/raw/main/Step1_cell_selection/inputs/CellDatabase_v6.xlsx"
    },
    {
      "name": "Length",
      "property": "Length",
      "quantity": {
        "value": 0.1432,
        "unit": "m"
      },
      "method": "https://github.com/TUMFTM/TruckBatteryDesign/raw/main/Step1_cell_selection/inputs/CellDatabase_v6.xlsx"
    }
  ]
}