{
  "battinfo_version": "0.1.0",
  "profile": "curated",
  "record": {
    "id": "cellinfo:OSN_OSN-08198255-LT28",
    "title": "OSN-08198255-LT28",
    "source": "https://github.com/TUMFTM/TruckBatteryDesign/raw/main/Step1_cell_selection/inputs/CellDatabase_v6.xlsx"
  },
  "battery": {
    "id": "OSN_OSN-08198255-LT28",
    "type": "cell",
    "chemistry": "LTO",
    "manufacturer": {
      "name": "OSN"
    },
    "nominal_capacity": {
      "value": 28.0,
      "unit": "Ah"
    },
    "nominal_voltage": {
      "value": 2.4,
      "unit": "V"
    },
    "mass": {
      "value": "NaN",
      "unit": "kg"
    }
  },
  "measurements": [
    {
      "name": "CycleLife",
      "property": "CycleLife",
      "quantity": {
        "value": 30000.0,
        "unit": "count"
      },
      "method": "https://github.com/TUMFTM/TruckBatteryDesign/raw/main/Step1_cell_selection/inputs/CellDatabase_v6.xlsx"
    },
    {
      "name": "UpperVoltageLimit",
      "property": "UpperVoltageLimit",
      "quantity": {
        "value": 2.8,
        "unit": "V"
      },
      "method": "https://github.com/TUMFTM/TruckBatteryDesign/raw/main/Step1_cell_selection/inputs/CellDatabase_v6.xlsx"
    },
    {
      "name": "LowerVoltageLimit",
      "property": "LowerVoltageLimit",
      "quantity": {
        "value": 1.6,
        "unit": "V"
      },
      "method": "https://github.com/TUMFTM/TruckBatteryDesign/raw/main/Step1_cell_selection/inputs/CellDatabase_v6.xlsx"
    },
    {
      "name": "DischargingCurrent",
      "property": "DischargingCurrent",
      "quantity": {
        "value": 28.0,
        "unit": "A"
      },
      "method": "https://github.com/TUMFTM/TruckBatteryDesign/raw/main/Step1_cell_selection/inputs/CellDatabase_v6.xlsx"
    },
    {
      "name": "MaximumContinuousDischargingCurrent",
      "property": "MaximumContinuousDischargingCurrent",
      "quantity": {
        "value": 420.0,
        "unit": "A"
      },
      "method": "https://github.com/TUMFTM/TruckBatteryDesign/raw/main/Step1_cell_selection/inputs/CellDatabase_v6.xlsx"
    },
    {
      "name": "ChargingCurrent",
      "property": "ChargingCurrent",
      "quantity": {
        "value": 28.0,
        "unit": "A"
      },
      "method": "https://github.com/TUMFTM/TruckBatteryDesign/raw/main/Step1_cell_selection/inputs/CellDatabase_v6.xlsx"
    },
    {
      "name": "MaximumContinuousChargingCurrent",
      "property": "MaximumContinuousChargingCurrent",
      "quantity": {
        "value": 168.0,
        "unit": "A"
      },
      "method": "https://github.com/TUMFTM/TruckBatteryDesign/raw/main/Step1_cell_selection/inputs/CellDatabase_v6.xlsx"
    },
    {
      "name": "Height",
      "property": "Height",
      "quantity": {
        "value": 0.008,
        "unit": "m"
      },
      "method": "https://github.com/TUMFTM/TruckBatteryDesign/raw/main/Step1_cell_selection/inputs/CellDatabase_v6.xlsx"
    },
    {
      "name": "Width",
      "property": "Width",
      "quantity": {
        "value": 0.198,
        "unit": "m"
      },
      "method": "https://github.com/TUMFTM/TruckBatteryDesign/raw/main/Step1_cell_selection/inputs/CellDatabase_v6.xlsx"
    },
    {
      "name": "Length",
      "property": "Length",
      "quantity": {
        "value": 0.225,
        "unit": "m"
      },
      "method": "https://github.com/TUMFTM/TruckBatteryDesign/raw/main/Step1_cell_selection/inputs/CellDatabase_v6.xlsx"
    }
  ]
}